<?xml version="1.0" encoding="UTF-8"?>
<tdt:epcTagDataTranslation version="2.2" date="2026-09-14T21:55:00Z" epcTDSVersion="2.2" xmlns:tdt="urn:epcglobal:tdt:xsd:2" xmlns:xsi="http://www.w3.org/2001/XMLSchema-instance" xsi:schemaLocation="urn:epcglobal:tdt:xsd:2 EpcTagDataTranslation.xsd">
	<scheme name="ITIP+" optionKey="1">
		<level type="BINARY" prefixMatch="11110011" requiredFormattingParameters="filter,dataToggle">
			<option optionKey="1" pattern="^11110011([01])([01]{3})" grammar="'11110011' dataToggle filter encodedAI">
				<field seq="1" name="dataToggle" decimalMinimum="0" decimalMaximum="1" characterSet="[01]*" bitPadDir="LEFT" bitLength="1"/>
				<field seq="2" name="filter" decimalMinimum="0" decimalMaximum="7" characterSet="[01]*" bitPadDir="LEFT" bitLength="3"/>
				<encodedAI ai="8006" name="itip" seq="3"/>
				<encodedAI ai="21" name="serial" seq="4"/>
			</option>
		</level>
		<level type="BARE_IDENTIFIER" prefixMatch="itip=">
			<option optionKey="1" pattern="^itip=([0-9]{18});serial=([!%-?A-Z_a-z\x22]{1,20})$" grammar="'itip=' itip ';serial=' serial">
				<field seq="1" name="itip" decimalMinimum="0" decimalMaximum="999999999999999999" characterSet="[0-9]*" length="18" padChar="0" padDir="LEFT"/>
				<field seq="2" name="serial" characterSet="[!%-?A-Z_a-z\x22]*"/>
			</option>
		</level>
		<level type="GS1_AI_JSON" prefixMatch="{">
			<option optionKey="1" pattern="^\{\s*\x228006\x22\s*:\s*\x22([0-9]{18})\x22\s*,\s*\x2221\x22\s*:\s*\x22((?:[!%-?A-Z_a-z]|\\\x22){1,20})\x22" grammar="'{&quot;8006&quot;:&quot;' itip '&quot;,&quot;21&quot;:&quot;' serial '&quot;}'" aiSequence="[&quot;8006&quot;,&quot;21&quot;]">
				<field seq="1" name="itip" decimalMinimum="0" decimalMaximum="999999999999999999" characterSet="[0-9]*" length="18" padChar="0" padDir="LEFT"/>
				<field seq="2" name="serial" characterSet="[!%-?A-Z_a-z\x22]*"/>
			</option>
		</level>
		<level type="GS1_DIGITAL_LINK" prefixMatch="http" requiredFormattingParameters="uriStem" gs1DigitalLinkKeyQualifiers="[&quot;22&quot;,&quot;10&quot;,&quot;21&quot;]">
			<option optionKey="1" pattern="\/8006\/([0-9]{18})\/21\/((?:[A-Za-z0-9\x22._-]|%21|%26|%27|%28|%29|%2A|%2B|%2C|%2F|%3A|%3B|%3C|%3D|%3E|%3F|%25){1,20})(?:\?|$)" grammar="uriStem '/8006/' itip '/21/' urlEscapedSerial" aiSequence="[&quot;8006&quot;,&quot;21&quot;]">
				<field seq="1" name="itip" decimalMinimum="0" decimalMaximum="999999999999999999" characterSet="[0-9]*" length="18" padChar="0" padDir="LEFT"/>
				<field seq="2" name="urlEscapedSerial" characterSet="((?:[A-Za-z0-9\x22._-]|%21|%26|%27|%28|%29|%2A|%2B|%2C|%2F|%3A|%3B|%3C|%3D|%3E|%3F|%25)*)"/>
			</option>
			<rule type="EXTRACT" inputFormat="STRING" seq="1" newFieldName="serial" characterSet="[!%-?A-Z_a-z\x22]*" function="URLDECODE(urlEscapedSerial)"/>
			<rule type="FORMAT" inputFormat="STRING" seq="1" newFieldName="urlEscapedSerial" characterSet="(?:[A-Za-z0-9\x22._-]|%21|%26|%27|%28|%29|%2A|%2B|%2C|%2F|%3A|%3B|%3C|%3D|%3E|%3F|%25)*" function="URLENCODE(serial)"/>
		</level>
	</scheme>
</tdt:epcTagDataTranslation>
