<?xml version="1.0" encoding="UTF-8"?>
<tdt:epcTagDataTranslation version="2.2" date="2026-09-14T21:55:00Z" epcTDSVersion="2.2" xmlns:tdt="urn:epcglobal:tdt:xsd:2" xmlns:xsi="http://www.w3.org/2001/XMLSchema-instance" xsi:schemaLocation="urn:epcglobal:tdt:xsd:2 EpcTagDataTranslation.xsd">
	<scheme name="CPI+" optionKey="1">
		<level type="BINARY" prefixMatch="11110000" requiredFormattingParameters="filter,dataToggle">
			<option optionKey="1" pattern="^11110000([01])([01]{3})" grammar="'11110000' dataToggle filter encodedAI">
				<field seq="1" name="dataToggle" decimalMinimum="0" decimalMaximum="1" characterSet="[01]*" bitPadDir="LEFT" bitLength="1"/>
				<field seq="2" name="filter" decimalMinimum="0" decimalMaximum="7" characterSet="[01]*" bitPadDir="LEFT" bitLength="3"/>
				<encodedAI ai="8010" name="cpi" seq="3"/>
				<encodedAI ai="8011" name="serial" seq="4"/>
			</option>
		</level>
		<level type="BARE_IDENTIFIER" prefixMatch="cpi=">
			<option optionKey="1" pattern="^cpi=([0-9]{4}[\x23\x2D\x2F\x30-\x39\x41-\x5A]{1,26});serial=([0-9]{1,12})$" grammar="'cpi=' cpi ';serial=' serial">
				<field seq="1" name="cpi" characterSet="[\x23\x2D\x2F\x30-\x39\x41-\x5A]*"/>
				<field seq="2" name="serial" decimalMinimum="0" decimalMaximum="999999999999" characterSet="[0-9]*"/>
			</option>
		</level>
		<level type="GS1_AI_JSON" prefixMatch="{">
			<option optionKey="1" pattern="^\{\s*\x228010\x22\s*:\s*\x22([0-9]{4}[\x23\x2D\x2F\x30-\x39\x41-\x5A]{1,26})\x22\s*,\s*\x228011\x22\s*:\s*\x22([0-9]{1,12})\x22" grammar="'{&quot;8010&quot;:&quot;' cpi '&quot;,&quot;8011&quot;:&quot;' serial '&quot;}'" aiSequence="[&quot;8010&quot;,&quot;8011&quot;]">
				<field seq="1" name="cpi" characterSet="[\x23\x2D\x2F\x30-\x39\x41-\x5A]*"/>
				<field seq="2" name="serial" decimalMinimum="0" decimalMaximum="999999999999" characterSet="[0-9]*"/>
			</option>
		</level>
		<level type="GS1_DIGITAL_LINK" prefixMatch="http" requiredFormattingParameters="uriStem" gs1DigitalLinkKeyQualifiers="[&quot;8011&quot;]">
			<option optionKey="1" pattern="\/8010\/([0-9]{4}(?:[A-Z0-9-]|%2F|%23){1,26})\/8011\/([0-9]{1,12})(?:\?|$)" grammar="uriStem '/8010/' urlEncodedCpi '/8011/' serial" aiSequence="[&quot;8010&quot;,&quot;8011&quot;]">
				<field seq="1" name="urlEncodedCpi" characterSet="((?:[A-Z0-9-]|%2F|%23)*)"/>
				<field seq="2" name="serial" decimalMinimum="0" decimalMaximum="999999999999" characterSet="[0-9]*"/>
			</option>
			<rule type="EXTRACT" inputFormat="STRING" seq="1" newFieldName="cpi" characterSet="[\x23\x2D\x2F\x30-\x39\x41-\x5A]*" function="URLDECODE(urlEncodedCpi)"/>
			<rule type="FORMAT" inputFormat="STRING" seq="1" newFieldName="urlEncodedCpi" characterSet="(?:[A-Z0-9-]|%2F|%23)*" function="URLENCODE(cpi)"/>
		</level>
	</scheme>
</tdt:epcTagDataTranslation>
