<?xml version="1.0" encoding="UTF-8"?>
<tdt:epcTagDataTranslation version="2.3" date="2024-11-23T19:45:00Z" epcTDSVersion="2.3" xmlns:tdt="urn:epcglobal:tdt:xsd:2" xmlns:xsi="http://www.w3.org/2001/XMLSchema-instance" xsi:schemaLocation="urn:epcglobal:tdt:xsd:2 EpcTagDataTranslation.xsd">
	<scheme name="GIAI++" optionKey="1">
		<level type="BINARY" prefixMatch="11101110" requiredFormattingParameters="filter,dataToggle">
			<option optionKey="1" pattern="^11101110([01])([01]{3})" grammar="'11101110' dataToggle filter encodedAI binaryHostname">
				<field seq="1" name="dataToggle" decimalMinimum="0" decimalMaximum="1" characterSet="[01]*" bitPadDir="LEFT" bitLength="1"/>
				<field seq="2" name="filter" decimalMinimum="0" decimalMaximum="7" characterSet="[01]*" bitPadDir="LEFT" bitLength="3"/>
				<encodedAI ai="8004" name="giai" seq="3"/>
			</option>
			<rule type="EXTRACT" inputFormat="STRING" seq="1" newFieldName="hostname" characterSet=".+" function="BINARY2HOSTNAME(binaryHostname)"/>
			<rule type="FORMAT" inputFormat="STRING" seq="1" newFieldName="binaryHostname" characterSet=".+" function="HOSTNAME2BINARY(hostname)"/>
		</level>
		<level type="BARE_IDENTIFIER" prefixMatch="giai=">
			<option optionKey="1" pattern="^giai=([0-9]{4}[!%-?A-Z_a-z\x22]{1,26})$" grammar="'giai=' giai ">
				<field seq="1" name="giai" characterSet="[!%-?A-Z_a-z\x22]*"/>
			</option>
		</level>
		<level type="GS1_AI_JSON" prefixMatch="{">
			<option optionKey="1" pattern="^\{\s*\x228004\x22\s*:\s*\x22([0-9]{4}(?:[!%-?A-Z_a-z]|\\\x22){1,26})\x22" grammar="'{&quot;8004&quot;:&quot;' giai '&quot;}'" aiSequence="[&quot;8004&quot;]">
				<field seq="1" name="giai" characterSet="[!%-?A-Z_a-z\x22]*"/>
			</option>
		</level>
		<level type="GS1_DIGITAL_LINK" prefixMatch="http" requiredFormattingParameters="hostname" gs1DigitalLinkKeyQualifiers="[]">
			<option optionKey="1" pattern="^https://(.+?)/8004/([0-9]{4}(?:[A-Za-z0-9\x22._-]|%21|%26|%27|%28|%29|%2A|%2B|%2C|%2F|%3A|%3B|%3C|%3D|%3E|%3F|%25){1,26})(?:\?|$)" grammar="'https://' hostname '/8004/' urlEscapedGiai " aiSequence="[&quot;8004&quot;]">
				<field seq="1" name="hostname" characterSet=".+"/>
				<field seq="2" name="urlEscapedGiai" characterSet="((?:[A-Za-z0-9\x22._-]|%21|%26|%27|%28|%29|%2A|%2B|%2C|%2F|%3A|%3B|%3C|%3D|%3E|%3F|%25)*)"/>
			</option>
			<rule type="EXTRACT" inputFormat="STRING" seq="1" newFieldName="giai" characterSet="[!%-?A-Z_a-z\x22]*" function="URLDECODE(urlEscapedGiai)"/>
			<rule type="FORMAT" inputFormat="STRING" seq="1" newFieldName="urlEscapedGiai" characterSet="(?:[A-Za-z0-9\x22._-]|%21|%26|%27|%28|%29|%2A|%2B|%2C|%2F|%3A|%3B|%3C|%3D|%3E|%3F|%25)*" function="URLENCODE(giai)"/>
		</level>
	</scheme>
</tdt:epcTagDataTranslation>
