<?xml version="1.0" encoding="UTF-8"?>
<tdt:epcTagDataTranslation version="2.3" date="2024-11-23T19:45:00Z" epcTDSVersion="2.3" xmlns:tdt="urn:epcglobal:tdt:xsd:2" xmlns:xsi="http://www.w3.org/2001/XMLSchema-instance" xsi:schemaLocation="urn:epcglobal:tdt:xsd:2 EpcTagDataTranslation.xsd">
	<scheme name="SGLN++" optionKey="1">
		<level type="BINARY" prefixMatch="11101001" requiredFormattingParameters="filter,dataToggle">
			<option optionKey="1" pattern="^11101001([01])([01]{3})" grammar="'11101001' dataToggle filter encodedAI binaryHostname">
				<field seq="1" name="dataToggle" decimalMinimum="0" decimalMaximum="1" characterSet="[01]*" bitPadDir="LEFT" bitLength="1"/>
				<field seq="2" name="filter" decimalMinimum="0" decimalMaximum="7" characterSet="[01]*" bitPadDir="LEFT" bitLength="3"/>
				<encodedAI ai="414" name="gln" seq="3"/>
				<encodedAI ai="254" name="serial" seq="4"/>
			</option>
			<rule type="EXTRACT" inputFormat="STRING" seq="1" newFieldName="hostname" characterSet=".+" function="BINARY2HOSTNAME(binaryHostname)"/>
			<rule type="FORMAT" inputFormat="STRING" seq="1" newFieldName="binaryHostname" characterSet=".+" function="HOSTNAME2BINARY(hostname)"/>
		</level>
		<level type="BARE_IDENTIFIER" prefixMatch="gln=">
			<option optionKey="1" pattern="^gln=([0-9]{13})(?:;serial=([!%-?A-Z_a-z\x22]{1,20}))?$" grammar="'gln=' gln ';serial=' serial">
				<field seq="1" name="gln" decimalMinimum="0" decimalMaximum="9999999999999" characterSet="[0-9]*" length="13" padChar="0" padDir="LEFT"/>
				<field seq="2" name="serial" characterSet="[!%-?A-Z_a-z\x22]*"/>
			</option>
		</level>
		<level type="GS1_AI_JSON" prefixMatch="{">
			<option optionKey="1" pattern="^\{\s*\x22414\x22\s*:\s*\x22([0-9]{13})\x22\s*,\s*\x22254\x22\s*:\s*\x22((?:[!%-?A-Z_a-z]|\\\x22){1,20})\x22" grammar="'{&quot;414&quot;:&quot;' gln '&quot;,&quot;254&quot;:&quot;' serial '&quot;}'" aiSequence="[&quot;414&quot;,&quot;254&quot;]">
				<field seq="1" name="gln" decimalMinimum="0" decimalMaximum="9999999999999" characterSet="[0-9]*" length="13" padChar="0" padDir="LEFT"/>
				<field seq="2" name="serial" characterSet="[!%-?A-Z_a-z\x22]*"/>
			</option>
		</level>
		<level type="GS1_DIGITAL_LINK" prefixMatch="http" requiredFormattingParameters="hostname" gs1DigitalLinkKeyQualifiers="[&quot;254&quot;]">
			<option optionKey="1" pattern="^https://(.+?)/414/([0-9]{13})(?:/254/((?:[A-Za-z0-9\x22._-]|%21|%26|%27|%28|%29|%2A|%2B|%2C|%2F|%3A|%3B|%3C|%3D|%3E|%3F|%25){1,20}))?(?:\?|$)" grammar="'https://' hostname '/414/' gln '/254/' urlEscapedSerial" aiSequence="[&quot;414&quot;,&quot;254&quot;]">
				<field seq="1" name="hostname" characterSet=".+"/>
				<field seq="2" name="gln" decimalMinimum="0" decimalMaximum="9999999999999" characterSet="[0-9]*" length="13" padChar="0" padDir="LEFT"/>
				<field seq="3" name="urlEscapedSerial" characterSet="((?:[A-Za-z0-9\x22._-]|%21|%26|%27|%28|%29|%2A|%2B|%2C|%2F|%3A|%3B|%3C|%3D|%3E|%3F|%25)*)"/>
			</option>
			<rule type="EXTRACT" inputFormat="STRING" seq="1" newFieldName="serial" characterSet="[!%-?A-Z_a-z\x22]*" function="URLDECODE(urlEscapedSerial)"/>
			<rule type="FORMAT" inputFormat="STRING" seq="1" newFieldName="urlEscapedSerial" characterSet="(?:[A-Za-z0-9\x22._-]|%21|%26|%27|%28|%29|%2A|%2B|%2C|%2F|%3A|%3B|%3C|%3D|%3E|%3F|%25)*" function="URLENCODE(serial)"/>
		</level>
	</scheme>
</tdt:epcTagDataTranslation>
