<?xml version="1.0" encoding="UTF-8"?>
<tdt:epcTagDataTranslation version="2.3" date="2024-11-23T19:45:00Z" epcTDSVersion="2.3" xmlns:tdt="urn:epcglobal:tdt:xsd:2" xmlns:xsi="http://www.w3.org/2001/XMLSchema-instance" xsi:schemaLocation="urn:epcglobal:tdt:xsd:2 EpcTagDataTranslation.xsd">
	<scheme name="SSCC++" optionKey="1">
		<level type="BINARY" prefixMatch="11101111" requiredFormattingParameters="filter,dataToggle">
			<option optionKey="1" pattern="^11101111([01])([01]{3})" grammar="'11101111' dataToggle filter encodedAI binaryHostname">
				<field seq="1" name="dataToggle" decimalMinimum="0" decimalMaximum="1" characterSet="[01]*" bitPadDir="LEFT" bitLength="1"/>
				<field seq="2" name="filter" decimalMinimum="0" decimalMaximum="7" characterSet="[01]*" bitPadDir="LEFT" bitLength="3"/>
				<encodedAI ai="00" name="sscc" seq="3"/>
			</option>
			<rule type="EXTRACT" inputFormat="STRING" seq="1" newFieldName="hostname" characterSet=".+" function="BINARY2HOSTNAME(binaryHostname)"/>
			<rule type="FORMAT" inputFormat="STRING" seq="1" newFieldName="binaryHostname" characterSet=".+" function="HOSTNAME2BINARY(hostname)"/>
		</level>
		<level type="BARE_IDENTIFIER" prefixMatch="sscc=">
			<option optionKey="1" pattern="^sscc=([0-9]{18})$" grammar="'sscc=' sscc ">
				<field seq="1" name="sscc" decimalMinimum="0" decimalMaximum="999999999999999999" characterSet="[0-9]*" length="18" padChar="0" padDir="LEFT"/>
			</option>
		</level>
		<level type="GS1_AI_JSON" prefixMatch="{">
			<option optionKey="1" pattern="^\{\s*\x2200\x22\s*:\s*\x22([0-9]{18})\x22" grammar="'{&quot;00&quot;:&quot;' sscc '&quot;}'" aiSequence="[&quot;00&quot;]">
				<field seq="1" name="sscc" decimalMinimum="0" decimalMaximum="999999999999999999" characterSet="[0-9]*" length="18" padChar="0" padDir="LEFT"/>
			</option>
		</level>
		<level type="GS1_DIGITAL_LINK" prefixMatch="http" requiredFormattingParameters="hostname" gs1DigitalLinkKeyQualifiers="[]">
			<option optionKey="1" pattern="^https://(.+?)/00/([0-9]{18})(?:\?|$)" grammar="'https://' hostname '/00/' sscc " aiSequence="[&quot;00&quot;]">
				<field seq="1" name="hostname" characterSet=".+"/>
				<field seq="2" name="sscc" decimalMinimum="0" decimalMaximum="999999999999999999" characterSet="[0-9]*" length="18" padChar="0" padDir="LEFT"/>
			</option>
		</level>
	</scheme>
</tdt:epcTagDataTranslation>
