<?xml version="1.0" encoding="UTF-8"?>
<tdt:epcTagDataTranslation version="2.3" date="2024-11-23T19:45:00Z" epcTDSVersion="2.3" xmlns:tdt="urn:epcglobal:tdt:xsd:2" xmlns:xsi="http://www.w3.org/2001/XMLSchema-instance" xsi:schemaLocation="urn:epcglobal:tdt:xsd:2 EpcTagDataTranslation.xsd">
	<scheme name="GDTI++" optionKey="1">
		<level type="BINARY" prefixMatch="11101010" requiredFormattingParameters="filter,dataToggle">
			<option optionKey="1" pattern="^11101010([01])([01]{3})" grammar="'11101010' dataToggle filter encodedAI binaryHostname">
				<field seq="1" name="dataToggle" decimalMinimum="0" decimalMaximum="1" characterSet="[01]*" bitPadDir="LEFT" bitLength="1"/>
				<field seq="2" name="filter" decimalMinimum="0" decimalMaximum="7" characterSet="[01]*" bitPadDir="LEFT" bitLength="3"/>
				<encodedAI ai="253" name="gdti" seq="3"/>
			</option>
			<rule type="EXTRACT" inputFormat="STRING" seq="1" newFieldName="hostname" characterSet=".+" function="BINARY2HOSTNAME(binaryHostname)"/>
			<rule type="FORMAT" inputFormat="STRING" seq="1" newFieldName="binaryHostname" characterSet=".+" function="HOSTNAME2BINARY(hostname)"/>
		</level>
		<level type="BARE_IDENTIFIER" prefixMatch="gdti=">
			<option optionKey="1" pattern="^gdti=([0-9]{13}[!%-?A-Z_a-z\x22]{1,17})$" grammar="'gdti=' gdti ">
				<field seq="1" name="gdti" characterSet="[!%-?A-Z_a-z\x22]*"/>
			</option>
		</level>
		<level type="GS1_AI_JSON" prefixMatch="{">
			<option optionKey="1" pattern="^\{\s*\x22253\x22\s*:\s*\x22([0-9]{13}(?:[!%-?A-Z_a-z]|\\\x22){1,17})\x22" grammar="'{&quot;253&quot;:&quot;' gdti '&quot;}'" aiSequence="[&quot;253&quot;]">
				<field seq="1" name="gdti" characterSet="[!%-?A-Z_a-z\x22]*"/>
			</option>
		</level>
		<level type="GS1_DIGITAL_LINK" prefixMatch="http" requiredFormattingParameters="hostname" gs1DigitalLinkKeyQualifiers="[]">
			<option optionKey="1" pattern="^https://(.+?)/253/([0-9]{13}(?:[A-Za-z0-9\x22._-]|%21|%26|%27|%28|%29|%2A|%2B|%2C|%2F|%3A|%3B|%3C|%3D|%3E|%3F|%25){1,17})(?:\?|$)" grammar="'https://' hostname '/253/' urlEscapedGdti " aiSequence="[&quot;253&quot;]">
				<field seq="1" name="hostname" characterSet=".+"/>
				<field seq="2" name="urlEscapedGdti" characterSet="((?:[A-Za-z0-9\x22._-]|%21|%26|%27|%28|%29|%2A|%2B|%2C|%2F|%3A|%3B|%3C|%3D|%3E|%3F|%25)*)"/>
			</option>
			<rule type="EXTRACT" inputFormat="STRING" seq="1" newFieldName="gdti" characterSet="[!%-?A-Z_a-z\x22]*" function="URLDECODE(urlEscapedGdti)"/>
			<rule type="FORMAT" inputFormat="STRING" seq="1" newFieldName="urlEscapedGdti" characterSet="(?:[A-Za-z0-9\x22._-]|%21|%26|%27|%28|%29|%2A|%2B|%2C|%2F|%3A|%3B|%3C|%3D|%3E|%3F|%25)*" function="URLENCODE(gdti)"/>
		</level>
	</scheme>
</tdt:epcTagDataTranslation>
