<?xml version="1.0" encoding="UTF-8"?>
<tdt:epcTagDataTranslation version="2.2" date="2024-11-18T16:30:00Z" epcTDSVersion="2.2" xmlns:tdt="urn:epcglobal:tdt:xsd:2" xmlns:xsi="http://www.w3.org/2001/XMLSchema-instance" xsi:schemaLocation="urn:epcglobal:tdt:xsd:2 EpcTagDataTranslation.xsd">
	<scheme name="GSRNP+" optionKey="1">
		<level type="BINARY" prefixMatch="11110101" requiredFormattingParameters="filter,dataToggle">
			<option optionKey="1" pattern="^11110101([01])([01]{3})" grammar="'11110101' dataToggle filter encodedAI">
				<field seq="1" name="dataToggle" decimalMinimum="0" decimalMaximum="1" characterSet="[01]*" bitPadDir="LEFT" bitLength="1"/>
				<field seq="2" name="filter" decimalMinimum="0" decimalMaximum="7" characterSet="[01]*" bitPadDir="LEFT" bitLength="3"/>
				<encodedAI ai="8017" name="gsrnp" seq="3"/>
			</option>
		</level>
		<level type="BARE_IDENTIFIER" prefixMatch="gsrnp=">
			<option optionKey="1" pattern="^gsrnp=([0-9]{18})$" grammar="'gsrnp=' gsrnp ">
				<field seq="1" name="gsrnp" decimalMinimum="0" decimalMaximum="999999999999999999" characterSet="[0-9]*" length="18" padChar="0" padDir="LEFT"/>
			</option>
		</level>
		<level type="GS1_AI_JSON" prefixMatch="{">
			<option optionKey="1" pattern="^\{\s*\x228017\x22\s*:\s*\x22([0-9]{18})\x22" grammar="'{&quot;8017&quot;:&quot;' gsrnp '&quot;}'" aiSequence="[&quot;8017&quot;]">
				<field seq="1" name="gsrnp" decimalMinimum="0" decimalMaximum="999999999999999999" characterSet="[0-9]*" length="18" padChar="0" padDir="LEFT"/>
			</option>
		</level>
		<level type="GS1_DIGITAL_LINK" prefixMatch="http" requiredFormattingParameters="uriStem" gs1DigitalLinkKeyQualifiers="[&quot;8019&quot;]">
			<option optionKey="1" pattern="\/8017\/([0-9]{18})(?:\?|$)" grammar="uriStem '/8017/' gsrnp " aiSequence="[&quot;8017&quot;]">
				<field seq="1" name="gsrnp" decimalMinimum="0" decimalMaximum="999999999999999999" characterSet="[0-9]*" length="18" padChar="0" padDir="LEFT"/>
			</option>
		</level>
	</scheme>
</tdt:epcTagDataTranslation>
